GLOSS	CATALAN_REF	CATALAN_SEQ	FRENCH_REF	FRENCH_SEQ	ITALIAN_REF	ITALIAN_SEQ	LATIN_REF	LATIN_SEQ	PORTUGUESE_REF	PORTUGUESE_SEQ	ROMANIAN_REF	ROMANIAN_SEQ	SPANISH_REF	SPANISH_SEQ
DRAW_MILK	m u ɲ i	m u ɲ i	t ʁ ɛː ʁ	t ʁ ɛː ʁ	m u n dʒ e r e	m u n dʒ e r e	m ʊ lˠ g eː r ɛ	m ʊ lˠ g eː r ɛ	o r ð e ɲ a r	o r ð e ɲ a r	m u l dʒ - - e	m u l dʒ e	o ɾ ð e ɲ a ɾ	o ɾ ð e ɲ a ɾ
DREAM	- - s - ɔ m n i -	s ɔ m n i	s ɔ̃ː ʒ	s ɔ̃ː ʒ	- - s - o - ɲː o -	s o ɲː o	- - s - ɔ m n ɪ ʊ̃	s ɔ m n ɪ ʊ̃	- - s - o - ɲ u -	s o ɲ u	v i s	v i s	e n s w e - ɲ o -	e n s w e ɲ o
DRESS_UP	β ə s t i ɾ z ə	β ə s t i ɾ z ə	s a b i j e	s a b i j e	v e s t i r z i	v e s t i r z i	w ɛ s t iː r - iː	w ɛ s t iː r iː	v ə ʃ t i r s ə	v ə ʃ t i r s ə	s e + ɨ m b r ə k a	s e + ɨ m b r ə k a	b e s t i ɾ s e	b e s t i ɾ s e
DRINK	b ɛ w - ɾ ə	b ɛ w ɾ ə	b w aː ʁ	b w aː ʁ	b e - - r e	b e r e	b ɪ b ɛ r ɛ	b ɪ b ɛ r ɛ	b ə β e r -	b ə β e r	b e a	b e a	b e β e ɾ -	b e β e ɾ
DRIVE	- ə n a	ə n a	ʁ u l e	ʁ u l e	v i a d dʒ a r e	v i a d dʒ a r e	w ɛ h iː	w ɛ h iː	i r	i r	m e r dʒ e	m e r dʒ e	i ɾ	i ɾ
DRIVE_(CATTLE)	ə r i a	ə r i a	m ə n e	m ə n e	s p i n dʒ e r e	s p i n dʒ e r e	a g ɛ r ɛ	a g ɛ r ɛ	k õ d u z i r	k õ d u z i r	m ɨ n ə	m ɨ n ə	a β a ʝ a ɾ	a β a ʝ a ɾ
DROP_(OF_A_LIQUID)	g ɔ - t̪ ə	g ɔ t̪ ə	g u - t -	g u t	g o t tʃ a	g o t tʃ a	gʷ - - tː a	gʷ tː a	g o - t ɐ	g o t ɐ	p i k ə t u r ə	p i k ə t u r ə	g o - t a	g o t a
DROP_(SOMETHING)	d̪ ə ʃ ə ɾ - + k a w - ɾ ə	d̪ ə ʃ ə ɾ + k a w ɾ ə	l ɛ s e + t ɔ̃ b e	l ɛ s e + t ɔ̃ b e	l a ʃː a r e + k a d e r e	l a ʃː a r e + k a d e r e	d iː m ɪ tː ɛ r ɛ	d iː m ɪ tː ɛ r ɛ	d e j ʃ a r k a j r	d e j ʃ a r k a j r	a r u n k a	a r u n k a	d e x a ɾ - + k a - e ɾ -	d e x a ɾ + k a e ɾ
DRY	s ɛ k -	s ɛ k	s ɛ k -	s ɛ k	s e kː o	s e kː o	aː r ɪ d ʊ s	aː r ɪ d ʊ s	s e k u	s e k u	u s k a t	u s k a t	s e k o	s e k o
DRY_UP	ə s ə k a ɾ z ə	ə s ə k a ɾ z ə	s e ʃ e	s e ʃ e	a ʃː u g a r z i	a ʃː u g a r z i	aː r eː s k ɛ r ɛ	aː r eː s k ɛ r ɛ	- s ə k a r - -	s ə k a r	s e + u s k a	s e + u s k a	- s e k a ɾ s e	s e k a ɾ s e
DUCK	a n ə k	a n ə k	k a n aː ʁ	k a n aː ʁ	a n a t r a	a n a t r a	a n a s	a n a s	p a t ɐ	p a t ɐ	r a ts ə	r a ts ə	p a t o	p a t o
DUST	p ɔ lˠ s	p ɔ lˠ s	p u s j ɛː ʁ	p u s j ɛː ʁ	p o l v e r e	p o l v e r e	p ʊ lˠ w ɪ s	p ʊ lˠ w ɪ s	p ɔ	p ɔ	p r a f	p r a f	p o l β - - o	p o l β o
DWELL_(LIVE,_RESIDE)	- ə β i t̪ - - a	ə β i t̪ a	d ə m œ ʁ e	d ə m œ ʁ e	- a b i t a r e	a b i t a r e	h a b ɪ t aː r ɛ	h a b ɪ t aː r ɛ	m u r a r	m u r a r	l o k u j	l o k u j	- a β i t a ɾ -	a β i t a ɾ
DYE	t̪ ə ɲ - i - -	t̪ ə ɲ i	t ɛ̃ː - d - ʁ ə	t ɛ̃ː d ʁ ə	t i n dʒ e r e	t i n dʒ e r e	t ɪ ŋ g ɛ r ɛ	t ɪ ŋ g ɛ r ɛ	k o l o r - i r	k o l o r i r	k o l o r - a -	k o l o r a	k o l o ɾ e a ɾ	k o l o ɾ e a ɾ
EAGLE	a ɣ - i lˠ ə	a ɣ i lˠ ə	ɛː g l ə	ɛː g l ə	a k w i l a	a k w i l a	a kʷ - ɪ lˠ a	a kʷ ɪ lˠ a	a ɣ j ɐ	a ɣ j ɐ	v u l t u r	v u l t u r	a ɣ - i l a	a ɣ i l a
EAR	u ɾ ɛ ʎ - ə	u ɾ ɛ ʎ ə	ɔ ʁ ɛ - j -	ɔ ʁ ɛ j	o r e kː j o	o r e kː j o	a ʊ r ɪ s	a ʊ r ɪ s	o r e ʎ - ɐ	o r e ʎ ɐ	u r e k - e	u r e k e	o ɾ e x - a	o ɾ e x a
EARTH_(SOIL)	t̪ - ɛ r ə	t̪ ɛ r ə	t - ɛː ʁ -	t ɛː ʁ	t - e rː a	t e rː a	t - ɛ rː a	t ɛ rː a	t - ɛ ʀ ɐ	t ɛ ʀ ɐ	p ə m ɨ n t	p ə m ɨ n t	t j e r a	t j e r a
EAST	u ɾ i ɛ n̪ - -	u ɾ i ɛ n̪	ɔ ʁ j ɑ̃	ɔ ʁ j ɑ̃	o r i e n t e	o r i e n t e	ɔ r ɪ ẽː s - -	ɔ r ɪ ẽː s	o r j e n t e	o r j e n t e	r ə s ə r i t	r ə s ə r i t	- e s t e	e s t e
EAT	m ə ɲ ʒ - - a	m ə ɲ ʒ a	m ɑ̃ - ʒ - - e	m ɑ̃ ʒ e	m a n dʒ a r e	m a n dʒ a r e	ɛ d ɛ r ɛ	ɛ d ɛ r ɛ	k u m e r	k u m e r	m ɨ n k - - a	m ɨ n k a	k o m e ɾ	k o m e ɾ
EDGE	k ə n̪ t̪ ɛ ʎ	k ə n̪ t̪ ɛ ʎ	a ʁ ɛː t	a ʁ ɛː t	s p i g o l o	s p i g o l o	a ŋ gʷ lˠ ʊ s	a ŋ gʷ lˠ ʊ s	a r e ʃ t a	a r e ʃ t a	b o r d u r ə	b o r d u r ə	b o ɾ ð - - e	b o ɾ ð e
EGG	- ɔ w -	ɔ w	- œ f -	œ f	u o v o	u o v o	- oː w ʊ̃	oː w ʊ̃	- o v u	o v u	- o w -	o w	w e β o	w e β o
EIGHT	β u j t̪	β u j t̪	ɥ i t	ɥ i t	o - tː o	o tː o	ɔ k t oː	ɔ k t oː	o j t u	o j t u	- o p t	o p t	o - tʃ o	o tʃ o
EIGHTY	β u j t̪ - - a n̪ t̪ ə	β u j t̪ a n̪ t̪ ə	k a t ʁ ə v ɛ̃	k a t ʁ ə v ɛ̃	- o - tː - - a n t a	o tː a n t a	- ɔ k t oː g ɪ n t aː	ɔ k t oː g ɪ n t aː	- o j t - - ẽ - t ɐ	o j t ẽ t ɐ	o p t z e tʃʲ	o p t z e tʃʲ	- o - tʃ - - e n t a	o tʃ e n t a
ELBOW	k ɔ lˠ z ə	k ɔ lˠ z ə	k u d -	k u d	g o m i t o	g o m i t o	k ʊ b ɪ t ʊ̃	k ʊ b ɪ t ʊ̃	k u t u v e l u	k u t u v e l u	k o t -	k o t	k o ð o	k o ð o
ELEVATION	t̪ u ɾ o	t̪ u ɾ o	e l e v ɑ s j ɔ̃	e l e v ɑ s j ɔ̃	a l t u r a	a l t u r a	s p ɛ k ʊ lˠ a	s p ɛ k ʊ lˠ a	o w t e j r u	o w t e j r u	r i d i k ə t u r ə	r i d i k ə t u r ə	θ e r o	θ e r o
ELEVEN	ɔ n z ə	ɔ n z ə	ɔ̃ː z	ɔ̃ː z	u n d i tʃ i	u n d i tʃ i	uː n d ɛ k ɪ̃	uː n d ɛ k ɪ̃	õ - z ə	õ z ə	u n s p r e z e tʃ e	u n s p r e z e tʃ e	o n θ e	o n θ e
ELK	a n̪	a n̪	e l ɑ̃	e l ɑ̃	a l tʃ e -	a l tʃ e	a lˠ k eː s	a lˠ k eː s	a lˠ s e -	a lˠ s e	j e l a n	j e l a n	a l θ e -	a l θ e
EMERGE_(APPEAR)	- ə - p ə ɾ ɛ ʃ ə - -	ə p ə ɾ ɛ ʃ ə	- a - p a ʁ ɛː t - ʁ ə	a p a ʁ ɛː t ʁ ə	k o m p a r i - - r e	k o m p a r i r e	- a - pː aː r eː - - r ɛ	a pː aː r eː r ɛ	- ɐ - p ɐ r ə s e r -	ɐ p ɐ r ə s e r	- a - p ə r e - a - -	a p ə r e a	- a - p a ɾ e θ e ɾ -	a p a ɾ e θ e ɾ
EMPTY	b u j t̪	b u j t̪	v i d	v i d	v u o t o	v u o t o	w a k ʊ ʊ s	w a k ʊ ʊ s	v ɐ z i w	v ɐ z i w	g o l	g o l	b a θ i o	b a θ i o
ENDURE	ə ɣ w ə n̪ t̪ a	ə ɣ w ə n̪ t̪ a	s y p ɔ ʁ t e - -	s y p ɔ ʁ t e	s o pː o r t a r e	s o pː o r t a r e	s ʊ s t ɪ n eː r ɛ	s ʊ s t ɪ n eː r ɛ	s u p u r t a r -	s u p u r t a r	s u p o r t a - -	s u p o r t a	s o p o ɾ t a ɾ -	s o p o ɾ t a ɾ
END_(OF_SPACE)	k a p - -	k a p	b u	b u	e - s t r e m i t a	e s t r e m i t a	k a p ʊ t	k a p ʊ t	e j ʃ t r e m - - u	e j ʃ t r e m u	k a p ə t	k a p ə t	e k s t ɾ e m - - o	e k s t ɾ e m o
END_(OF_TIME)	f i n a lˠ -	f i n a lˠ	f ɛ̃ -	f ɛ̃	f i n e - -	f i n e	f iː n ɪ s -	f iː n ɪ s	f ĩ -	f ĩ	s f ɨ r ʃ i t	s f ɨ r ʃ i t	f i n a l -	f i n a l
ENEMY	ə n ə m i k - -	ə n ə m i k	ɛ n - m i - - -	ɛ n m i	- n e m i k o -	n e m i k o	ɪ n ɪ m iː k ʊ s	ɪ n ɪ m iː k ʊ s	i n ə m i ɣ u -	i n ə m i ɣ u	d u ʃ m a n	d u ʃ m a n	e n e m i ɣ o -	e n e m i ɣ o
ENTER	ə n̪ t̪ ɾ a - -	ə n̪ t̪ ɾ a	ɑ̃ - t ʁ e - -	ɑ̃ t ʁ e	e n t r a r e	e n t r a r e	ɪ ŋ g r ɛ d iː	ɪ ŋ g r ɛ d iː	ẽ - t r a r -	ẽ t r a r	i n t r a - -	i n t r a	e n t ɾ a ɾ -	e n t ɾ a ɾ
ESCAPE	r ə f u ʒ i - a ɾ z ə	r ə f u ʒ i a ɾ z ə	s ɑ̃ f ɥ iː ʁ	s ɑ̃ f ɥ iː ʁ	s f u d dʒ i r e	s f u d dʒ i r e	ɛ fː ʊ g ɛ r ɛ	ɛ fː ʊ g ɛ r ɛ	r e f u ʒ - j a r ʃ e	r e f u ʒ j a r ʃ e	j e v a d a	j e v a d a	e s k a p a ɾ s e	e s k a p a ɾ s e
EVENING	β ɛ s p - ɾ ə	β ɛ s p ɾ ə	s w a - ʁ - - e	s w a ʁ e	s - e - r a t a	s e r a t a	w ɛ s p ɛ r -	w ɛ s p ɛ r	t ɐ r d i ɲ ɐ	t ɐ r d i ɲ ɐ	s - e a r - - ə	s e a r ə	n o - tʃ e	n o tʃ e
EVERYWHERE	p ə ɾ + t̪ u t̪ + ə r ɛ w	p ə ɾ + t̪ u t̪ + ə r ɛ w	- - p a ʁ t u - -	p a ʁ t u	d a pː e r t u tː o	d a pː e r t u tː o	ʊ b iː kʷ ɛ	ʊ b iː kʷ ɛ	- ẽ - + t o ð ɐ - + p a r t ə -	ẽ + t o ð ɐ + p a r t ə	p r e t u t i n d e nʲ	p r e t u t i n d e nʲ	p o ɾ + t o ð a s + p a ɾ t e s	p o ɾ + t o ð a s + p a ɾ t e s
EVIL	d̪ u lˠ ɛ n̪	d̪ u lˠ ɛ n̪	m o v ɛ	m o v ɛ	k a tː i v o	k a tː i v o	ɪ m p r ɔ b ʊ s	ɪ m p r ɔ b ʊ s	m a w	m a w	r ə w t ə tʃ j o s	r ə w t ə tʃ j o s	m a l o	m a l o
EXPENSIVE	k a - - -	k a	ʃ ɛː ʁ	ʃ ɛː ʁ	k a r o -	k a r o	k aː r ʊ s	k aː r ʊ s	k a r u -	k a r u	s k u m p	s k u m p	k a ɾ o -	k a ɾ o
EYE	u ʎ - -	u ʎ	œ - j -	œ j	o kː j o	o kː j o	ɔ k ʊ lˠ ʊ s	ɔ k ʊ lˠ ʊ s	o ʎ - u	o ʎ u	o kʲ	o kʲ	o x - o	o x o
FACE	k a ɾ ə	k a ɾ ə	v i z aː ʒ	v i z aː ʒ	f a t tʃ a	f a t tʃ a	w ʊ lˠ t uː s	w ʊ lˠ t uː s	ʀ o ʃ t u	ʀ o ʃ t u	f i g u r ə	f i g u r ə	k a ɾ a	k a ɾ a
FAIRY_TALE	k - ɔ n̪ t̪ ə	k ɔ n̪ t̪ ə	k ɔ̃ː t + d ə + f eː	k ɔ̃ː t + d ə + f eː	f a v o l a	f a v o l a	f aː b ʊ lˠ a	f aː b ʊ lˠ a	k - õ - t u	k õ t u	p o v e s t e	p o v e s t e	k w e n t o	k w e n t o
FALL	t̪ u m β a	t̪ u m β a	t ɔ̃ b e	t ɔ̃ b e	k a d e r e	k a d e r e	k a d ɛ r ɛ	k a d ɛ r ɛ	k ɐ - i r -	k ɐ i r	k ə d e - a	k ə d e a	k a - e ɾ -	k a e ɾ
FALL_ASLEEP	- ə ð u ɾ m - - - i ɾ z ə	ə ð u ɾ m i ɾ z ə	s ɑ̃ d ɔ ʁ m - - - iː ʁ - -	s ɑ̃ d ɔ ʁ m iː ʁ	- a dː o r m e n t a r z i	a dː o r m e n t a r z i	ɔ b d ɔ r m iː s k ɛ r ɛ	ɔ b d ɔ r m iː s k ɛ r ɛ	- ɐ ð u r m ə - s e r - -	ɐ ð u r m ə s e r	a d o r mʲ	a d o r mʲ	- - d o ɾ m - - - i ɾ s e	d o ɾ m i ɾ s e
FAMILIAR	k u n ə - ɣ u t̪ -	k u n ə ɣ u t̪	k ɔ n y	k ɔ n y	k o n o ʃː - u t o	k o n o ʃː u t o	n oː t ʊ s	n oː t ʊ s	k u ɲ ə s - i ð u	k u ɲ ə s i ð u	k u n o s k u t -	k u n o s k u t	k o n o θ - i ð o	k o n o θ i ð o
FAMILY	f ə m i lˠ i a	f ə m i lˠ i a	f a m i j - -	f a m i j	f a m i ʎː - a	f a m i ʎː a	f a m ɪ lˠ ɪ a	f a m ɪ lˠ ɪ a	f ɐ m i l j ɐ	f ɐ m i l j ɐ	f a m i l j e	f a m i l j e	f a m i l j a	f a m i l j a
FAR	d̪ i s t a n̪ -	d̪ i s t a n̪	l w ɛ̃ t ɛ̃	l w ɛ̃ t ɛ̃	l o n t a n o	l o n t a n o	lˠ ɔ ŋ g ɪ ŋ kʷ ʊ s	lˠ ɔ ŋ g ɪ ŋ kʷ ʊ s	d i ʃ t ã t e	d i ʃ t ã t e	d e p a r t e	d e p a r t e	l e - x a n o	l e x a n o
FATHER	p a - - ɾ ə	p a ɾ ə	p ɛː - - ʁ -	p ɛː ʁ	p a d - r e	p a d r e	p a t ɛ r -	p a t ɛ r	p a - - j -	p a j	p ə r i n t e	p ə r i n t e	p a ð - ɾ e	p a ð ɾ e
FAT_(OBESE)	g ɾ a s - -	g ɾ a s	g ʁ ɑ - - -	g ʁ ɑ	g r a sː o -	g r a sː o	k r a sː ʊ s	k r a sː ʊ s	g o r ð - - u	g o r ð u	g r a s - -	g r a s	o β e s o	o β e s o
FAT_(ORGANIC_SUBSTANCE)	g ɾ ɛ ʃ - -	g ɾ ɛ ʃ	g ʁ ɛ s - -	g ʁ ɛ s	g r a sː o -	g r a sː o	p ɪ ŋ gʷ ɛ	p ɪ ŋ gʷ ɛ	ɣ o r ð u r a	ɣ o r ð u r a	g r ə s i m e	g r ə s i m e	g ɾ a s a -	g ɾ a s a
FAULT	k u lˠ p ə	k u lˠ p ə	k y l p a b i l i t e	k y l p a b i l i t e	k o l p a	k o l p a	k ʊ lˠ p a	k ʊ lˠ p a	k u lˠ p ɐ	k u lˠ p ɐ	v i n ə	v i n ə	k u l p a	k u l p a
FEAR_(BE_AFRAID)	t̪ ə n i ɾ + p - - - ɔ	t̪ ə n i ɾ + p ɔ	a v w aː ʁ - + p œː - ʁ -	a v w aː ʁ + p œː ʁ	a v - e r e + p a u r a	a v e r e + p a u r a	w ɛ r eː r ɪ	w ɛ r eː r ɪ	t e r r e s e j o ð e	t e r r e s e j o ð e	f i + t e a m ə + a	f i + t e a m ə + a	t e n e ɾ + m j e ð o	t e n e ɾ + m j e ð o
FEATHER	p lˠ ɔ m ə	p lˠ ɔ m ə	p l y m -	p l y m	p e nː a	p e nː a	p ɛ nː a	p ɛ nː a	p e n ɐ	p e n ɐ	p a n ə	p a n ə	p l u m a	p l u m a
FEBRUARY	f ə β - ɾ - - - - - ɛ -	f ə β ɾ ɛ	f e v - ʁ - - - - i e -	f e v ʁ i e	f e bː - r - a - - i o -	f e bː r a i o	f ɛ b - r ʊ aː - r ɪ ʊ s	f ɛ b r ʊ aː r ɪ ʊ s	f ə v ə r - e j r - u -	f ə v ə r e j r u	f e b r w a r j e	f e b r w a r j e	f e β - ɾ - e - ɾ - o -	f e β ɾ e ɾ o
FEED	d̪ u n ə ɾ + m ə ɲ ʒ ə ɾ + a	d̪ u n ə ɾ + m ə ɲ ʒ ə ɾ + a	f ɛː ʁ + m ɑ̃ ʒ e	f ɛː ʁ + m ɑ̃ ʒ e	d a r + d a + m a n dʒ a r e + a	d a r + d a + m a n dʒ a r e + a	n uː t r iː r ɛ	n uː t r iː r ɛ	d a r ð e k o m e r a	d a r ð e k o m e r a	d a + d e + m ɨ n k a r e	d a + d e + m ɨ n k a r e	e tʃ a ɾ + ð e + k o m e ɾ	e tʃ a ɾ + ð e + k o m e ɾ
FEEL_(TACTUALLY)	s ə n̪ t̪ i - -	s ə n̪ t̪ i	s ɑ̃ - t iː ʁ -	s ɑ̃ t iː ʁ	s e n t i r e	s e n t i r e	s ɛ n t iː r ɛ	s ɛ n t iː r ɛ	s ẽ - t i r -	s ẽ t i r	r e s i m tsʲ	r e s i m tsʲ	s e n t i ɾ -	s e n t i ɾ
FENCE	t̪ a ŋ k ə	t̪ a ŋ k ə	k l o t yː ʁ	k l o t yː ʁ	r e tʃ i n t o	r e tʃ i n t o	s a ɛ p eː s	s a ɛ p eː s	v e ð a s ã w	v e ð a s ã w	g a r d	g a r d	θ e ɾ k a ð o	θ e ɾ k a ð o
FEVER	f - ɛ β ɾ ə -	f ɛ β ɾ ə	f j ɛː v ʁ ə -	f j ɛː v ʁ ə	f - e bː r e -	f e bː r e	f - ɛ b r ɪ s	f ɛ b r ɪ s	f - ɛ β r ə -	f ɛ β r ə	f - e b r ə -	f e b r ə	f j e β ɾ e -	f j e β ɾ e
FIFTY	s i ŋ k - w a n̪ t̪ ə	s i ŋ k w a n̪ t̪ ə	s ɛ̃ - k - - ɑ̃ː - t -	s ɛ̃ k ɑ̃ː t	tʃ i n k - w a n t a	tʃ i n k w a n t a	kʷ iː ŋ kʷ aː g iː n t aː	kʷ iː ŋ kʷ aː g iː n t aː	s ĩ - k - w ẽ - t ɐ	s ĩ k w ẽ t ɐ	tʃ i n tʃ i z e tʃʲ	tʃ i n tʃ i z e tʃʲ	θ i ŋ k - w e n t a	θ i ŋ k w e n t a
FILL	- u m p lˠ - - i	u m p lˠ i	ʁ ɑ̃ p l iː ʁ	ʁ ɑ̃ p l iː ʁ	r i e m p i r e	r i e m p i r e	k ɔ m p lˠ eː r ɛ	k ɔ m p lˠ eː r ɛ	ẽ ʃ e r	ẽ ʃ e r	- u m p l - - e	u m p l e	ʝ e n a ɾ	ʝ e n a ɾ
FIND	t̪ ɾ u β - - a	t̪ ɾ u β a	t ʁ u v - - e	t ʁ u v e	t r o v a r e	t r o v a r e	r ɛ p ɛ r iː r ɛ	r ɛ p ɛ r iː r ɛ	ẽ - k õ - t r a r	ẽ k õ t r a r	g ə sʲ	g ə sʲ	e ŋ k o n t ɾ a ɾ	e ŋ k o n t ɾ a ɾ
FINE_OR_THIN	f i	f i	m ə n y	m ə n y	d e l i k a t o	d e l i k a t o	s ʊ b t iː lˠ ɪ s	s ʊ b t iː lˠ ɪ s	ʃ u β t i lˠ	ʃ u β t i lˠ	s u b ts i r e	s u b ts i r e	d e l i k a ð o	d e l i k a ð o
FINGER	d̪ i t̪ -	d̪ i t̪	d w a	d w a	d i t o	d i t o	d ɪ g ɪ t ʊ s	d ɪ g ɪ t ʊ s	d e ð u	d e ð u	d e dʒ e t	d e dʒ e t	d e ð o	d e ð o
FINGERNAIL	u ŋ g lˠ ə	u ŋ g lˠ ə	ɔ̃ - g l ə	ɔ̃ g l ə	u ŋ g j a	u ŋ g j a	ʊ ŋ gʷ ɪ k ʊ lˠ ʊ s	ʊ ŋ gʷ ɪ k ʊ lˠ ʊ s	u ɲ ɐ	u ɲ ɐ	u n g j e	u n g j e	u ɲ a	u ɲ a
FINGERNAIL_OR_TOENAIL	u ŋ g lˠ ə	u ŋ g lˠ ə	ɔ̃ - g l ə	ɔ̃ g l ə	u ŋ g j a	u ŋ g j a	ʊ ŋ gʷ ɪ s	ʊ ŋ gʷ ɪ s	u ɲ ɐ	u ɲ ɐ	u n g j e	u n g j e	u ɲ a	u ɲ a
FINISH	ə k ə β a -	ə k ə β a	t ɛ ʁ m i n e - -	t ɛ ʁ m i n e	t e r m i n a r e	t e r m i n a r e	f iː n iː r ɛ	f iː n iː r ɛ	t ə r m i n a r -	t ə r m i n a r	t e r m i n a - -	t e r m i n a	t e ɾ m i n a ɾ -	t e ɾ m i n a ɾ
FIR	ə β ɛ t̪ -	ə β ɛ t̪	s a p ɛ̃	s a p ɛ̃	a b e t e	a b e t e	a b ɪ eː s	a b ɪ eː s	a β e t u	a β e t u	b r a d	b r a d	a β e t o	a β e t o
FIRE	f - ɔ - k -	f ɔ k	f - ø - - -	f ø	f - u o k o	f u o k o	ɪ ŋ n ɪ s	ɪ ŋ n ɪ s	f - o - ɣ u	f o ɣ u	f - o - k -	f o k	f w e - ɣ o	f w e ɣ o
FIRST	p ɾ i m - - - ɛ	p ɾ i m ɛ	p ʁ ə m - j - e	p ʁ ə m j e	p r i m - - - o	p r i m o	p r iː m ʊ - s -	p r iː m ʊ s	p r i m e j r u	p r i m e j r u	p r i m - - - -	p r i m	p ɾ i m e - ɾ o	p ɾ i m e ɾ o
FISH	p ɛ - ʃ - -	p ɛ ʃ	p w a s ɔ̃	p w a s ɔ̃	p e - ʃː - e	p e ʃː e	p ɪ s k ɪ s -	p ɪ s k ɪ s	p e j ʃ - ə	p e j ʃ ə	p e - ʃ t e	p e ʃ t e	p e - θ - -	p e θ
FISHING	p ə s k a - -	p ə s k a	p ɛ - ʃ - e	p ɛ ʃ e	p e s k a r e	p e s k a r e	p ɪ s k aː r iː	p ɪ s k aː r iː	p ə ʃ k a r -	p ə ʃ k a r	p e s k u j -	p e s k u j	p e s k a ɾ -	p e s k a ɾ
FIVE	s i ŋ -	s i ŋ	s ɛ̃ k -	s ɛ̃ k	tʃ i n k w e	tʃ i n k w e	kʷ iː ŋ kʷ - ɛ	kʷ iː ŋ kʷ ɛ	s ĩ k u	s ĩ k u	tʃ i n tʃʲ	tʃ i n tʃʲ	θ i ŋ k - o	θ i ŋ k o
FLAT	p lˠ a - - - -	p lˠ a	p l a - - - -	p l a	p - i a tː o -	p i a tː o	p lˠ aː - n ʊ s	p lˠ aː n ʊ s	p l ɐ - n u -	p l ɐ n u	p l a - n - -	p l a n	p l a - n o -	p l a n o
FLEE	f u - ʒ i - -	f u ʒ i	f - - ɥ iː ʁ -	f ɥ iː ʁ	f u d dʒ i r e	f u d dʒ i r e	f ʊ - g ɛ r ɛ	f ʊ g ɛ r ɛ	f u - ʒ i r -	f u ʒ i r	f u dʒʲ	f u dʒʲ	w i ɾ	w i ɾ
FLOCK_(OF_ANIMALS)	r ə m a t̪	r ə m a t̪	t ʁ u p o	t ʁ u p o	g r e d dʒ e	g r e d dʒ e	g r ɛ k s	g r ɛ k s	r e β a ɲ u	r e β a ɲ u	tʃ i r e a d ə	tʃ i r e a d ə	ɾ e β a ɲ o	ɾ e β a ɲ o
FLOOR	t̪ ɛ r ə	t̪ ɛ r ə	p l ɑ̃ ʃ e	p l ɑ̃ ʃ e	p a v i m e n t o	p a v i m e n t o	s - ɔ lˠ ʊ̃	s ɔ lˠ ʊ̃	p i z u	p i z u	d u ʃ u m e a	d u ʃ u m e a	s w e l o	s w e l o
FLOW	f lˠ u j	f lˠ u j	k u l e	k u l e	s k o rː e r e	s k o rː e r e	m aː n aː r ɛ	m aː n aː r ɛ	f l w i - r -	f l w i r	k u r dʒ e	k u r dʒ e	- k o r e ɾ -	k o r e ɾ
FLOWER	f lˠ ɔ - - -	f lˠ ɔ	f l œː - ʁ -	f l œː ʁ	f i o r e	f i o r e	f lˠ oː - s -	f lˠ oː s	f l o - r -	f l o r	f l o a r e	f l o a r e	f l o - ɾ -	f l o ɾ
FLY_(INSECT)	m ɔ s k ə	m ɔ s k ə	m u ʃ - -	m u ʃ	m o s k a	m o s k a	m ʊ s k a	m ʊ s k a	m o ʃ k ɐ	m o ʃ k ɐ	m u s k ə	m u s k ə	m o s k a	m o s k a
FLY_(MOVE_THROUGH_AIR)	β u lˠ a - -	β u lˠ a	v ɔ l e - -	v ɔ l e	v o l a r e	v o l a r e	w ɔ lˠ aː r ɛ	w ɔ lˠ aː r ɛ	v w a r	v w a r	z b u r a	z b u r a	b o l a ɾ -	b o l a ɾ
FOAM	ə s k - u m ə	ə s k u m ə	m u s	m u s	- s k j u m a	s k j u m a	- s p - uː m a	s p uː m a	i ʃ p - u m a	i ʃ p u m a	- s p - u m ə	s p u m ə	e s p - u m a	e s p u m a
FOG	b ɔ j ɾ ə	b ɔ j ɾ ə	b ʁ u j aː ʁ	b ʁ u j aː ʁ	n - e bː i - a	n e bː i a	n - ɛ b ʊ lˠ a	n ɛ b ʊ lˠ a	n ə v w e j r u	n ə v w e j r u	n e g u r ə	n e g u r ə	n j e β - l a	n j e β l a
FOOD	ə lˠ i m ɛ n̪ - -	ə lˠ i m ɛ n̪	n u ʁ i t yː ʁ	n u ʁ i t yː ʁ	a l i m e n t o	a l i m e n t o	a lˠ ɪ m ɛ n t a	a lˠ ɪ m ɛ n t a	ɐ l i m ẽ - t u	ɐ l i m ẽ t u	a l i m e n t -	a l i m e n t	a l i m e n t o	a l i m e n t o
FOOT	p - ɛ w	p ɛ w	p j e -	p j e	p i e d e	p i e d e	p - eː s	p eː s	p - ɛ -	p ɛ	p i tʃ j o r	p i tʃ j o r	p j e -	p j e
FOOTPRINT	t̪ ɾ a - s ə	t̪ ɾ a s ə	t ʁ a - s -	t ʁ a s	t r a t tʃ a	t r a t tʃ a	w ɛ s t iː g - ɪ ʊ̃	w ɛ s t iː g ɪ ʊ̃	v e ʃ t i ʒ j - u	v e ʃ t i ʒ j u	d ɨ r ə	d ɨ r ə	w e ʝ a	w e ʝ a
FOREHEAD	f ɾ ɔ n̪ - -	f ɾ ɔ n̪	f ʁ ɔ̃ - - -	f ʁ ɔ̃	f r o n t e	f r o n t e	f r õː s - -	f r õː s	t ɛ ʃ t ɐ	t ɛ ʃ t ɐ	f r u n t e	f r u n t e	f ɾ e n t e	f ɾ e n t e
FOREIGN	ə - s t ɾ a ɲ - - - -	ə s t ɾ a ɲ	e t ʁ ɑ̃ ʒ e	e t ʁ ɑ̃ ʒ e	- - s t r a n i e r o	s t r a n i e r o	p ɛ r ɛ g r iː n ʊ s	p ɛ r ɛ g r iː n ʊ s	i - ʃ t r ɐ ɲ - - - u	i ʃ t r ɐ ɲ u	s t r ə j n	s t r ə j n	e k s t ɾ a ɲ - - - o	e k s t ɾ a ɲ o
FOREST	b ɔ s k -	b ɔ s k	f ɔ ʁ ɛ	f ɔ ʁ ɛ	f - o r e s t a	f o r e s t a	s ɪ lˠ w a	s ɪ lˠ w a	f l u r ɛ ʃ t ɐ	f l u r ɛ ʃ t ɐ	p ə d u r e	p ə d u r e	b o s k e	b o s k e
FORGET	u b lˠ i ð a	u b lˠ i ð a	u b l i - e	u b l i e	d i m e n t i k a r e	d i m e n t i k a r e	ɔ b l iː w iː s k iː	ɔ b l iː w iː s k iː	i ʃ k ɛ s e r	i ʃ k ɛ s e r	u j t a	u j t a	o l β i ð a ɾ	o l β i ð a ɾ
FORK	f u ɾ k i ʎ - - ə	f u ɾ k i ʎ ə	f u ʁ ʃ ɛ - - t -	f u ʁ ʃ ɛ t	f o r k e - - tː a	f o r k e tː a	f ʊ s k ɪ n ʊ lˠ a	f ʊ s k ɪ n ʊ lˠ a	g a r f u	g a r f u	f u r k u l i ts ə	f u r k u l i ts ə	t e n e ð o ɾ	t e n e ð o ɾ
FORMER	ə n̪ t̪ i k - -	ə n̪ t̪ i k	ɑ̃ s j ɛ̃	ɑ̃ s j ɛ̃	d u n a + v o l t a	d u n a + v o l t a	p r iː s t ɪ n ʊ s	p r iː s t ɪ n ʊ s	ɐ̃ - t i ɣ - u	ɐ̃ t i ɣ u	a n t e r j o r	a n t e r j o r	a n t i ɣ w o	a n t i ɣ w o
FORTY	k w ə - ɾ a - - n̪ t̪ ə	k w ə ɾ a n̪ t̪ ə	k - a - ʁ ɑ̃ː - - - t -	k a ʁ ɑ̃ː t	k w a - r a - - n t a	k w a r a n t a	kʷ - a d r aː g ɪ n t aː	kʷ a d r aː g ɪ n t aː	k w ɐ - r ẽ - - - t ɐ	k w ɐ r ẽ t ɐ	p a t r u z e tʃʲ	p a t r u z e tʃʲ	k w a - ɾ e - - n t a	k w a ɾ e n t a
FORWARD	ə n ð ə β a n̪	ə n ð ə β a n̪	ɑ̃ n a v ɑ̃	ɑ̃ n a v ɑ̃	a v a n t i	a v a n t i	p ɔ rː oː	p ɔ rː oː	ɐ v ɐ̃ - t ə	ɐ v ɐ̃ t ə	ɨ n a j n t e	ɨ n a j n t e	a ð e l a n t e	a ð e l a n t e
FOR_A_LONG_TIME	m u lˠ t̪ - + d̪ ə + t̪ - ə m p - s	m u lˠ t̪ + d̪ ə + t̪ ə m p s	l ɔ̃ t ɑ̃	l ɔ̃ t ɑ̃	a + - - - - l u ŋ g o -	a + l u ŋ g o	d ɪ uː	d ɪ uː	m w i t o t ẽ p u	m w i t o t ẽ p u	m u l t + t i m p	m u l t + t i m p	m u - tʃ o + - - - t j e m p o -	m u tʃ o + t j e m p o
FOUR	k w a t̪ ɾ ə	k w a t̪ ɾ ə	k - a t ʁ ə	k a t ʁ ə	k w a tː r o	k w a tː r o	kʷ a tː ʊ ɔ r	kʷ a tː ʊ ɔ r	k w a t r u	k w a t r u	p a t r u	p a t r u	k w a t ɾ o	k w a t ɾ o
FOX	g i ʎ ə	g i ʎ ə	ʁ ə n aː ʁ	ʁ ə n aː ʁ	v o l p e -	v o l p e	w ʊ lˠ p eː s	w ʊ lˠ p eː s	r a p o z a	r a p o z a	v u l p e -	v u l p e	θ o r o	θ o r o
FREEZE	- - - ʒ ə lˠ a ɾ z ə	ʒ ə lˠ a ɾ z ə	- - - ʒ ə l e - - -	ʒ ə l e	k o n dʒ e l a r z i	k o n dʒ e l a r z i	k ɔ ŋ g ɛ lˠ aː r - iː	k ɔ ŋ g ɛ lˠ aː r iː	k õ - ʒ ə l a r - -	k õ ʒ ə l a r	ɨ n g e ts a	ɨ n g e ts a	- - - - e l a ɾ s e	e l a ɾ s e
FRESH	f ɾ ɛ s k -	f ɾ ɛ s k	f ʁ ɛ - - -	f ʁ ɛ	f r e s k o	f r e s k o	r ɛ k ẽː s	r ɛ k ẽː s	f r ɛ ʃ k u	f r ɛ ʃ k u	p r o a s p ə t	p r o a s p ə t	f ɾ e s k o	f ɾ e s k o
FRIDAY	d̪ i β ɛ n ð ɾ ə s	d̪ i β ɛ n ð ɾ ə s	v ɑ̃ d ʁ ə d i	v ɑ̃ d ʁ ə d i	v e n e r d i	v e n e r d i	d ɪ eː s + w ɛ n ɛ r ɪ s	d ɪ eː s + w ɛ n ɛ r ɪ s	s e j ʃ t ɐ f e j r ɐ	s e j ʃ t ɐ f e j r ɐ	v i n e rʲ - -	v i n e rʲ	b j e ɾ n e s	b j e ɾ n e s
FRIEND	ə m i k - -	ə m i k	a m i - - -	a m i	a m i k o -	a m i k o	a m iː k ʊ s	a m iː k ʊ s	ɐ m i ɣ u -	ɐ m i ɣ u	p r j e t e n	p r j e t e n	a m i ɣ o -	a m i ɣ o
FRINGE	m a ɾ ʒ ə -	m a ɾ ʒ ə	b ɔ ʁ - - - -	b ɔ ʁ	b o r d - - o	b o r d o	m a r g oː -	m a r g oː	m a r ʒ ẽ j	m a r ʒ ẽ j	b o r d u r ə	b o r d u r ə	b o ɾ ð - - e	b o ɾ ð e
FROM_HERE	d̪ ə s - - + d̪ ə k i	d̪ ə s + d̪ ə k i	d i s i	d i s i	d a + k w i	d a + k w i	h ɪ ŋ k	h ɪ ŋ k	d a k i	d a k i	d e + a i tʃʲ	d e + a i tʃʲ	d e z ð e + - a k i	d e z ð e + a k i
FROST	g lˠ ə s a ð ə	g lˠ ə s a ð ə	ʒ ə l e	ʒ ə l e	dʒ e l o	dʒ e l o	g ɛ lˠ uː	g ɛ lˠ uː	ʒ j a ð ɐ	ʒ j a ð ɐ	dʒ e r	dʒ e r	e l a ð a	e l a ð a
FRY	- r u s t i - -	r u s t i	- ʁ o - t iː ʁ -	ʁ o t iː ʁ	a rː o s t i r e	a rː o s t i r e	t ɔ rː eː r ɛ	t ɔ rː eː r ɛ	f r i - t a r -	f r i t a r	k o a tʃ e	k o a tʃ e	f ɾ e - - i ɾ -	f ɾ e i ɾ
FULL	p lˠ ɛ - - -	p lˠ ɛ	ʁ ɑ̃ p l i	ʁ ɑ̃ p l i	p i e n o	p i e n o	p lˠ eː n ʊ s	p lˠ eː n ʊ s	ʃ e j u	ʃ e j u	p l i n - -	p l i n	ʝ e n o	ʝ e n o
FUR	p - ɛ ʎ - -	p ɛ ʎ	p o	p o	p e l a m e	p e l a m e	p - ɛ lː ɪ s	p ɛ lː ɪ s	p - ɛ l ə -	p ɛ l ə	p j e l e -	p j e l e	p j e l - -	p j e l
GAME	ʒ ɔ k -	ʒ ɔ k	ʒ ø - -	ʒ ø	dʒ o k o	dʒ o k o	lˠ uː d ʊ s	lˠ uː d ʊ s	ʒ o ɣ u	ʒ o ɣ u	ʒ o k -	ʒ o k	x w e ɣ o	x w e ɣ o
GAP_(DISTANCE)	d̪ i s t a n s i a	d̪ i s t a n s i a	e k aː ʁ	e k aː ʁ	d i s t a n ts - a	d i s t a n ts a	ɪ n t ɛ r w a lː ʊ̃	ɪ n t ɛ r w a lː ʊ̃	d i ʃ t ɐ̃ - s j ɐ	d i ʃ t ɐ̃ s j ɐ	d e p ə r t a r e	d e p ə r t a r e	d i s t a n θ j a	d i s t a n θ j a
GATE	p - u - ɾ t̪ a lˠ -	p u ɾ t̪ a lˠ	p - ɔ - ʁ t a j -	p ɔ ʁ t a j	p - o - r t o n e	p o r t o n e	p - ɔ - r t a - -	p ɔ r t a	p - o - r t ã w -	p o r t ã w	p - o a r t ə - -	p o a r t ə	p w e - ɾ t a - -	p w e ɾ t a
GATHER	k u lˠː ə k - s i u n - - a	k u lˠː ə k s i u n a	k ɔ l ɛ k s j - ɔ n - - e	k ɔ l ɛ k s j ɔ n e	k o lː e ts - - i o n a r e	k o lː e ts i o n a r e	- - k ɔ lː ɪ g ɛ r ɛ	k ɔ lː ɪ g ɛ r ɛ	k u l ɛ s - j - u n a r -	k u l ɛ s j u n a r	k o l e k ts j - o n - - a	k o l e k ts j o n a	k o l e k θ j - o n a ɾ -	k o l e k θ j o n a ɾ
GENTLE	s w a w -	s w a w	d u	d u	d o l tʃ e	d o l tʃ e	k lˠ eː m ẽː s	k lˠ eː m ẽː s	b r ã d u	b r ã d u	b l a ʒ i n -	b l a ʒ i n	s w a β e	s w a β e
GET	r ɛ - - β - - ɾ ə	r ɛ β ɾ ə	ʁ ə s - v w aː ʁ -	ʁ ə s v w aː ʁ	r i tʃ e v - e r e	r i tʃ e v e r e	a kː ɪ p ɛ r ɛ	a kː ɪ p ɛ r ɛ	ʀ ə s ə β - e r -	ʀ ə s ə β e r	k ə p ə t a	k ə p ə t a	ɾ e θ i β - i ɾ -	ɾ e θ i β i ɾ
GET_TIRED	k ə n z a ɾ z ə	k ə n z a ɾ z ə	s ə f a t i g e	s ə f a t i g e	s t a ŋ k a r z i	s t a ŋ k a r z i	f a t iː g aː r - iː	f a t iː g aː r iː	k ã - ʃ a r ʃ e	k ã ʃ a r ʃ e	s e + o b o sʲ	s e + o b o sʲ	f a t i ɣ a ɾ s e	f a t i ɣ a ɾ s e
GIFT	u β s ɛ k i	u β s ɛ k i	p ʁ e z - - ɑ̃	p ʁ e z ɑ̃	r e g a l o	r e g a l o	m uː n ʊ s	m uː n ʊ s	p r ə z ẽ t ə	p r ə z ẽ t ə	k a d o w	k a d o w	ɾ e ɣ a l o	ɾ e ɣ a l o
GIRL	n ɔ j ə	n ɔ j ə	ʒ œ n + f i j	ʒ œ n + f i j	r a g a t ts a	r a g a t ts a	p ʊ ɛ lː a	p ʊ ɛ lː a	ʀ ɐ p ɐ r i ɣ ɐ	ʀ ɐ p ɐ r i ɣ ɐ	f a t ə	f a t ə	m u tʃ a tʃ a	m u tʃ a tʃ a
GIVE	d̪ u n - - a	d̪ u n a	d ɔ n - - e	d ɔ n e	d a r e	d a r e	d a r ɛ	d a r ɛ	d a r -	d a r	d a	d a	d a ɾ -	d a ɾ
GLASS	β i ð ɾ - ə	β i ð ɾ ə	v ɛː - ʁ - -	v ɛː ʁ	v e t r - o	v e t r o	w ɪ t r - ʊ̃	w ɪ t r ʊ̃	v i ð r - u	v i ð r u	s t i k l ə	s t i k l ə	k ɾ i s t a l	k ɾ i s t a l
GLUE	ə n ɣ ə ɲ ʃ a	ə n ɣ ə ɲ ʃ a	- - k ɔ l e - -	k ɔ l e	i ŋ k o lː a r e	i ŋ k o lː a r e	a gː lˠ uː t ɪ n aː r ɛ	a gː lˠ uː t ɪ n aː r ɛ	- - k u l a r -	k u l a r	l i pʲ	l i pʲ	e ŋ k o l a ɾ -	e ŋ k o l a ɾ
GO	k ə m i n a	k ə m i n a	a l e	a l e	- a n d a r e	a n d a r e	w aː - d ɛ r ɛ	w aː d ɛ r ɛ	- ɐ̃ - d a r -	ɐ̃ d a r	m e r dʒ e	m e r dʒ e	- a n d a ɾ -	a n d a ɾ
GOLD	ɔ	ɔ	ɔː ʁ	ɔː ʁ	o - r o	o r o	a ʊ r ʊ̃	a ʊ r ʊ̃	o - r u	o r u	a w r	a w r	o - ɾ o	o ɾ o
GOOD	b ɔ -	b ɔ	b ɔ̃ -	b ɔ̃	b u o n o -	b u o n o	b - ɔ n ʊ s	b ɔ n ʊ s	b õ -	b õ	b u n	b u n	b w e n o -	b w e n o
GOOD-LOOKING	m a k u	m a k u	ʒ ɔ l i	ʒ ɔ l i	k a r i n o	k a r i n o	p ʊ lˠ k h ɛ r	p ʊ lˠ k h ɛ r	b u n i t u	b u n i t u	d r ə g u ts	d r ə g u ts	g w a p o	g w a p o
