GLOSS	CATALAN_REF	CATALAN_SEQ	FRENCH_REF	FRENCH_SEQ	ITALIAN_REF	ITALIAN_SEQ	LATIN_REF	LATIN_SEQ	PORTUGUESE_REF	PORTUGUESE_SEQ	ROMANIAN_REF	ROMANIAN_SEQ	SPANISH_REF	SPANISH_SEQ
PICK	k u ʎ - - - i	k u ʎ i	k œ j - iː ʁ -	k œ j iː ʁ	k ɔ ʎː i e r e	k ɔ ʎː i e r e	k a r p ɛ r ɛ	k a r p ɛ r ɛ	k u ʎ - e r -	k u ʎ e r	k u l - e dʒ e	k u l e dʒ e	k o x - e ɾ -	k o x e ɾ
PICK_UP	ə ʃ ə k a	ə ʃ ə k a	ʁ a m a s e	ʁ a m a s e	r a kː ɔ ʎː i e r e	r a kː ɔ ʎː i e r e	t ɔ lː ɛ r ɛ	t ɔ lː ɛ r ɛ	l ə v ɐ̃ t a r	l ə v ɐ̃ t a r	l w a + d e + ʒ o s	l w a + d e + ʒ o s	ɾ e k o x - e ɾ -	ɾ e k o x e ɾ
PICTURE_(PAINTING)	i m a dʒ - - ə	i m a dʒ ə	t a b - l o -	t a b l o	i mː a dʒ i n e	i mː a dʒ i n e	p ɪ k t uː r a	p ɪ k t uː r a	i m a ʒ ẽ j	i m a ʒ ẽ j	i m a dʒ i n e	i m a dʒ i n e	i m a x e n	i m a x e n
PIECE	p - ɛ - - s ə	p ɛ s ə	m ɔ ʁ s o	m ɔ ʁ s o	p - e t - ts o	p e t ts o	f r a g m ɛ n t ʊ̃	f r a g m ɛ n t ʊ̃	p - ə ð a s u	p ə ð a s u	b u k a t ə	b u k a t ə	p j e θ - - a	p j e θ a
PIG	b ə - k o -	b ə k o	k ɔ ʃ ɔ̃	k ɔ ʃ ɔ̃	m a i a l e	m a i a l e	p ɔ r k ʊ s	p ɔ r k ʊ s	p o r k u -	p o r k u	p o r k - -	p o r k	θ e ɾ ð o	θ e ɾ ð o
PIKE_(FISH)	ʎ u s - -	ʎ u s	b ʁ ɔ ʃ ɛ	b ʁ ɔ ʃ ɛ	l u t tʃ o	l u t tʃ o	ɛ s ɔ k s	ɛ s ɔ k s	l u s j u	l u s j u	ʃ t i w k ə	ʃ t i w k ə	l u θ j o	l u θ j o
PILLOW	k u ʃ i - -	k u ʃ i	ɔ ʁ ɛ j e	ɔ ʁ ɛ j e	g u a n tʃ a l e	g u a n tʃ a l e	p ʊ lˠ w iː n ʊ s	p ʊ lˠ w iː n ʊ s	a lˠ m o f a ð a	a lˠ m o f a ð a	p e r n ə	p e r n ə	a l m o - a ð a	a l m o a ð a
PINE	p i - - - - -	p i	p ɛ̃ - - - - -	p ɛ̃	p i n o - - -	p i n o	p ɪ n ʊ - s -	p ɪ n ʊ s	p i ɲ e j r u	p i ɲ e j r u	p i n - - - -	p i n	p i n o - - -	p i n o
PIT_(POTHOLE)	k lˠ ɔ t̪	k lˠ ɔ t̪	f oː s -	f oː s	f o sː a	f o sː a	f ɔ w ɛ a	f ɔ w ɛ a	f o s a	f o s a	g r o a p ə	g r o a p ə	f o s o	f o s o
PLACE_(POSITION)	ʎ ɔ - k - -	ʎ ɔ k	ɑ̃ d ʁ w a	ɑ̃ d ʁ w a	l o k a l i t a	l o k a l i t a	lˠ ɔ - k ʊ s	lˠ ɔ k ʊ s	s i t j u	s i t j u	l o - k - -	l o k	s i t j o	s i t j o
PLAY	ʒ u ɣ a - -	ʒ u ɣ a	ʒ w e	ʒ w e	dʒ o k a r e	dʒ o k a r e	lˠ uː d ɛ r ɛ	lˠ uː d ɛ r ɛ	b r ĩ k a r	b r ĩ k a r	s e + ʒ u k a	s e + ʒ u k a	x u ɣ a ɾ -	x u ɣ a ɾ
POINTED	p u ɲ ʃ ə ɣ u t̪	p u ɲ ʃ ə ɣ u t̪	p w ɛ̃ t y	p w ɛ̃ t y	a pː u n t i t o	a pː u n t i t o	a k uː t - ʊ s	a k uː t ʊ s	a ɣ u ð - u -	a ɣ u ð u	a s k u ts i t	a s k u ts i t	a p u n t a ð o	a p u n t a ð o
POOR	p ɔ β - ɾ ə	p ɔ β ɾ ə	p oː v - ʁ ə	p oː v ʁ ə	p ɔ v e r o	p ɔ v e r o	p a ʊ p ɛ r	p a ʊ p ɛ r	p ɔ β - r ə	p ɔ β r ə	s ə r m a n	s ə r m a n	p o β - ɾ e	p o β ɾ e
POST	- β a ɾ ə	β a ɾ ə	p ɛ ʁ ʃ	p ɛ ʁ ʃ	p ɛ r t i k a	p ɛ r t i k a	p ɛ r t ɪ k a	p ɛ r t ɪ k a	- b a ʀ a	b a ʀ a	p r ə ʒ i n ə	p r ə ʒ i n ə	p e ɾ tʃ - - a	p e ɾ tʃ a
POT	ɔ - ʎ ə	ɔ ʎ ə	m a ʁ m i t -	m a ʁ m i t	p ɛ n t o l a	p ɛ n t o l a	oː - lː a	oː lː a	p a n ɛ l a	p a n ɛ l a	o a l ə	o a l ə	m a ɾ m i t a	m a ɾ m i t a
POUCH	b ɔ - s ə	b ɔ s ə	p ə t i + s a k	p ə t i + s a k	s a kː e tː o	s a kː e tː o	s a kː ʊ lˠ ʊ s	s a kː ʊ lˠ ʊ s	b ɔ lˠ s ə	b ɔ lˠ s ə	s ə k u l e ts	s ə k u l e ts	b o l s a	b o l s a
POUR	ə β u k a	ə β u k a	v ɛ ʁ s - - e	v ɛ ʁ s e	v e r z a r e	v e r z a r e	f ʊ n d ɛ r ɛ	f ʊ n d ɛ r ɛ	d e j t a r	d e j t a r	v ə r s - - a	v ə r s a	b e ɾ t e ɾ	b e ɾ t e ɾ
POWER	p u t̪ ɛ n s i a	p u t̪ ɛ n s i a	p ɥ i s ɑ̃ː s	p ɥ i s ɑ̃ː s	p o t e r e	p o t e r e	p ɔ t ɛ s t aː s	p ɔ t ɛ s t aː s	p o t ẽ - s j a	p o t ẽ s j a	p u t i n ts - ə	p u t i n ts ə	p o t e n θ j a	p o t e n θ j a
POWERFUL	β i ɣ u ɾ o s	β i ɣ u ɾ o s	v i g u ʁ ø -	v i g u ʁ ø	r o b u s t o -	r o b u s t o	r oː b ʊ s t ʊ s	r oː b ʊ s t ʊ s	p u ð ə r o z u	p u ð ə r o z u	r o b u s t - -	r o b u s t	f w e ɾ t e	f w e ɾ t e
PRECIOUS	p ɾ ə s - i o s - -	p ɾ ə s i o s	p ʁ e s j - - - ø -	p ʁ e s j ø	p r e ts - i o z o -	p r e ts i o z o	p r ɛ t - ɪ oː s ʊ s	p r ɛ t ɪ oː s ʊ s	p r e s j - u z u -	p r e s j u z u	p r e ts j - o s - -	p r e ts j o s	p ɾ e θ j - o s o -	p ɾ e θ j o s o
PREPARE	p - ɾ ə p - - ə ɾ a	p ɾ ə p ə ɾ a	p - ʁ e p - - a ʁ e	p ʁ e p a ʁ e	p - r e p a r a r e	p r e p a r a r e	p a r - - - - aː r ɛ	p a r aː r ɛ	p - r ə p ɐ r a r -	p r ə p ɐ r a r	p r e g ə tʲ	p r e g ə tʲ	p - ɾ e p a ɾ a ɾ -	p ɾ e p a ɾ a ɾ
PRESERVE	- k u n z ə ɾ β - - a	k u n z ə ɾ β a	p ʁ e - z ɛ ʁ v e - -	p ʁ e z ɛ ʁ v e	- k o n z e r v a r e	k o n z e r v a r e	- k õː - s ɛ r w aː r ɛ	k õː s ɛ r w aː r ɛ	- k õ - s ə r v a r -	k õ s ə r v a r	p ə s t r a	p ə s t r a	p ɾ e - s e ɾ β a ɾ -	p ɾ e s e ɾ β a ɾ
PRESS	ə s t ɾ ɛ ɲ ə	ə s t ɾ ɛ ɲ ə	p ʁ ɛ s e	p ʁ ɛ s e	p r e m e r e	p r e m e r e	p r ɛ m ɛ r ɛ	p r ɛ m ɛ r ɛ	ɐ p ə r - t a r	ɐ p ə r t a r	s t r ɨ n dʒ e	s t r ɨ n dʒ e	a p - ɾ e t a ɾ	a p ɾ e t a ɾ
PRICE	p ɾ ɛ w - -	p ɾ ɛ w	p ʁ i - - -	p ʁ i	p r e t ts o	p r e t ts o	p r ɛ t ɪ ʊ̃	p r ɛ t ɪ ʊ̃	p r e s - u	p r e s u	p r e ts - -	p r e ts	p ɾ e θ j o	p ɾ e θ j o
PRODUCE	p ɾ u ð u s i - -	p ɾ u ð u s i	f a b ʁ i k e - -	f a b ʁ i k e	f a bː r i k a r e	f a bː r i k a r e	f a b r ɪ k aː r ɛ	f a b r ɪ k aː r ɛ	p r u ð u z i r -	p r u ð u z i r	k o n f e k ts j o n a	k o n f e k ts j o n a	f a β ɾ i k a ɾ -	f a β ɾ i k a ɾ
PROMISE	p ɾ u m ɛ t̪ - ɾ ə	p ɾ u m ɛ t̪ ɾ ə	p ʁ ɔ m ɛ t - ʁ ə	p ʁ ɔ m ɛ t ʁ ə	p r o m e tː e r e	p r o m e tː e r e	p r oː m ɪ tː ɛ r ɛ	p r oː m ɪ tː ɛ r ɛ	p r u m ə t e r -	p r u m ə t e r	f ə g ə d u j	f ə g ə d u j	p ɾ o m e t e ɾ -	p ɾ o m e t e ɾ
PROTECT	p ɾ u t̪ ə - ʒ i - -	p ɾ u t̪ ə ʒ i	p ʁ ɔ t e - ʒ e - -	p ʁ ɔ t e ʒ e	p r o t ɛ d dʒ e r e	p r o t ɛ d dʒ e r e	t uː t aː r iː	t uː t aː r iː	p r u t ə - ʒ e r -	p r u t ə ʒ e r	p r o t e - ʒ a - -	p r o t e ʒ a	p ɾ o t e - x e ɾ -	p ɾ o t e x e ɾ
PULL	ə s t i ɾ - - a - -	ə s t i ɾ a	- - t i ʁ - - e - -	t i ʁ e	- - t i r - - a r e	t i r a r e	- - t - r a h ɛ r ɛ	t r a h ɛ r ɛ	p u ʃ a r	p u ʃ a r	t r a dʒ e	t r a dʒ e	- - t i ɾ - - a ɾ -	t i ɾ a ɾ
PUSH	ə m p ɛ ɲ - ə	ə m p ɛ ɲ ə	p u s e	p u s e	s p i n dʒ e r e	s p i n dʒ e r e	p r oː m ɔ w eː r ɛ	p r oː m ɔ w eː r ɛ	ẽ - p u ʀ a r	ẽ p u ʀ a r	ɨ m p i n dʒ e	ɨ m p i n dʒ e	e m p u x a ɾ	e m p u x a ɾ
PUT_ON	p u z a ɾ z ə	p u z a ɾ z ə	m ɛ t - ʁ - ə	m ɛ t ʁ ə	i n d o sː a r e	i n d o sː a r e	ɪ n d ʊ - ɛ r ɛ	ɪ n d ʊ ɛ r ɛ	v ə ʃ t i r	v ə ʃ t i r	ɨ m b r ə k a	ɨ m b r ə k a	p o n e ɾ s e	p o n e ɾ s e
RAINBOW	ə ɾ k - + i ɾ i s	ə ɾ k + i ɾ i s	a ʁ k ɑ̃ s j ɛ l	a ʁ k ɑ̃ s j ɛ l	a r k o b a l e n o	a r k o b a l e n o	a r k ʊ s	a r k ʊ s	a r k o i r i ʃ	a r k o i r i ʃ	k u r k u b e w	k u r k u b e w	a ɾ k o + i ɾ i s	a ɾ k o + i ɾ i s
RAIN_(PRECIPITATION)	p lˠ u ʒ ə	p lˠ u ʒ ə	p l ɥ i	p l ɥ i	p i o d dʒ a	p i o d dʒ a	p lˠ ʊ - w ɪ - a	p lˠ ʊ w ɪ a	ʃ u v - ɐ -	ʃ u v ɐ	p l o a j e	p l o a j e	ʝ u β j a -	ʝ u β j a
RAIN_(RAINING)	p lˠ ɔ - w - ɾ ə	p lˠ ɔ w ɾ ə	p l œ v w aː ʁ -	p l œ v w aː ʁ	p i ɔ v e r e	p i ɔ v e r e	p lˠ ʊ - - ɛ r ɛ	p lˠ ʊ ɛ r ɛ	ʃ u v - e r	ʃ u v e r	p l o - w - - a	p l o w a	ʝ o β - e ɾ	ʝ o β e ɾ
RAISE_(BRING_UP)	k ɾ - i - a	k ɾ i a	e l v e	e l v e	a lː e v a r e	a lː e v a r e	n uː t r iː r ɛ	n uː t r iː r ɛ	k r j a r -	k r j a r	k r e ʃ t e	k r e ʃ t e	k ɾ j a ɾ -	k ɾ j a ɾ
RAW	k ɾ u - - -	k ɾ u	b ʁ y t - -	b ʁ y t	k r u d o -	k r u d o	k r uː d ʊ s	k r uː d ʊ s	k r u - - -	k r u	k r u d - -	k r u d	k ɾ u ð o -	k ɾ u ð o
READ	ʎ ə ʒ i	ʎ ə ʒ i	l iː - - - ʁ -	l iː ʁ	l ɛ d dʒ e r e	l ɛ d dʒ e r e	lˠ ɛ - g ɛ r ɛ	lˠ ɛ g ɛ r ɛ	l e - - - r -	l e r	tʃ i tʲ	tʃ i tʲ	l e - - e ɾ -	l e e ɾ
REASON	k a w - z ə	k a w z ə	ʁ ɛ z ɔ̃	ʁ ɛ z ɔ̃	r a dʒ o n e	r a dʒ o n e	k a - ʊ s a	k a ʊ s a	m u t i v u	m u t i v u	p r i tʃ i n ə	p r i tʃ i n ə	k a - u s a	k a u s a
RECOGNIZE_(SOMEBODY)	r ə k u - n ɛ - ʃ - ə - -	r ə k u n ɛ ʃ ə	ʁ ə k ɔ - n ɛː - - t - ʁ ə	ʁ ə k ɔ n ɛː t ʁ ə	r i k o - n o - ʃː - e r e	r i k o n o ʃː e r e	- - k oː ŋ n oː - s k ɛ r ɛ	k oː ŋ n oː s k ɛ r ɛ	ʀ ə k u - ɲ ə - s - e r -	ʀ ə k u ɲ ə s e r	r e k u - n o a ʃ t - - e	r e k u n o a ʃ t e	ɾ e k o - n o - θ - e ɾ -	ɾ e k o n o θ e ɾ
RECOVER	r ə k u p ə ɾ a ɾ z ə	r ə k u p ə ɾ a ɾ z ə	s ə ʁ ə m ɛ t ʁ ə	s ə ʁ ə m ɛ t ʁ ə	g u a r i r e	g u a r i r e	k ɔ n w a lˠ eː s k ɛ r ɛ	k ɔ n w a lˠ eː s k ɛ r ɛ	k õ - v a l e ʃ s e r -	k õ v a l e ʃ s e r	s e + ɨ n s ə n ə t o ʃʲ	s e + ɨ n s ə n ə t o ʃʲ	ɾ e s t a β l e θ e ɾ s e	ɾ e s t a β l e θ e ɾ s e
RED	β ə ɾ m ɛ ʎ -	β ə ɾ m ɛ ʎ	ʁ uː ʒ -	ʁ uː ʒ	r o sː o	r o sː o	r ʊ b ɛ r	r ʊ b ɛ r	v ə r m e ʎ u	v ə r m e ʎ u	r o ʃ u	r o ʃ u	ɾ o x o	ɾ o x o
REMAIN	k ə ð a ɾ z ə	k ə ð a ɾ z ə	d ə m œ ʁ e	d ə m œ ʁ e	r i m a n e r e	r i m a n e r e	- - m a n eː r ɛ	m a n eː r ɛ	p e r m a n e s e r	p e r m a n e s e r	r ə m ɨ n - - e	r ə m ɨ n e	k e ð a ɾ s e	k e ð a ɾ s e
REMEMBER	r ə k u ɾ ð a - - - - - -	r ə k u ɾ ð a	s ə s u v ə n i ʁ + d ə	s ə s u v ə n i ʁ + d ə	r i k o r d a r z i + d i	r i k o r d a r z i + d i	m ɛ m ɪ n ɪ sː ɛ	m ɛ m ɪ n ɪ sː ɛ	ʀ ə k u r ð a r s ə + d ə	ʀ ə k u r ð a r s ə + d ə	a ʃ i + a m i n t i + d e	a ʃ i + a m i n t i + d e	- a k o ɾ ð a ɾ s e + ð e	a k o ɾ ð a ɾ s e + ð e
REPAIR	r ə p ə ɾ a - -	r ə p ə ɾ a	ʁ e p a ʁ e - -	ʁ e p a ʁ e	r i p a r a r e	r i p a r a r e	r ɛ p a r aː r ɛ	r ɛ p a r aː r ɛ	k õ s ə r t a r	k õ s ə r t a r	r e p a r a - -	r e p a r a	ɾ e p a ɾ a ɾ -	ɾ e p a ɾ a ɾ
RESCUE	s ə lˠ β a - -	s ə lˠ β a	s o - v e - -	s o v e	s a l v a r e	s a l v a r e	s ɛ r w aː r ɛ	s ɛ r w aː r ɛ	s a lˠ v a r -	s a lˠ v a r	s a l v a - -	s a l v a	s a l β a ɾ -	s a l β a ɾ
REST	d̪ ə s k ə n z a -	d̪ ə s k ə n z a	s ə d e t ɑ̃ː d ʁ ə	s ə d e t ɑ̃ː d ʁ ə	r i p o z a r z i	r i p o z a r z i	s eː + r ɛ f ɪ k ɛ r ɛ	s eː + r ɛ f ɪ k ɛ r ɛ	d ə ʃ k ɐ̃ - s a r	d ə ʃ k ɐ̃ s a r	s e + d e s t i n d e	s e + d e s t i n d e	d e s k a n s a ɾ	d e s k a n s a ɾ
RESULT_IN	s u ɾ t̪ i	s u ɾ t̪ i	ʁ e y s iː ʁ	ʁ e y s iː ʁ	s t a r e	s t a r e	eː w ɛ n iː r ɛ	eː w ɛ n iː r ɛ	- - - - d a r r e z u lˠ t a ð u	d a r r e z u lˠ t a ð u	r e w ʃʲ	r e w ʃʲ	d a ɾ + - - - ɾ e s u l t a ð o	d a ɾ + ɾ e s u l t a ð o
RIBBON	s i n̪ t̪ ə	s i n̪ t̪ ə	ʁ y b ɑ̃	ʁ y b ɑ̃	f e tː u t tʃ a	f e tː u t tʃ a	r ɛ d ɪ m iː k ʊ lˠ ʊ̃	r ɛ d ɪ m iː k ʊ lˠ ʊ̃	f a j ʃ ɐ	f a j ʃ ɐ	ʃ i r e t	ʃ i r e t	θ i n t a	θ i n t a
RICH	r i k -	r i k	ʁ i ʃ -	ʁ i ʃ	r i kː o	r i kː o	d iː w ɛ s	d iː w ɛ s	ʀ i k u	ʀ i k u	b o g a t	b o g a t	ɾ i k o	ɾ i k o
RIGHT	d̪ - ɾ - ɛ - t̪ -	d̪ ɾ ɛ t̪	d - ʁ w a - - -	d ʁ w a	d e s t r o	d e s t r o	d ɛ k s t ɛ r	d ɛ k s t ɛ r	d i r - e j t u	d i r e j t u	d - r - e p t -	d r e p t	d e ɾ - e - tʃ o	d e ɾ e tʃ o
RING	ə n ɛ ʎ - -	ə n ɛ ʎ	b a g	b a g	a n e lː o -	a n e lː o	aː n ʊ lˠ ʊ s	aː n ʊ lˠ ʊ s	ɐ n ɛ lˠ - -	ɐ n ɛ lˠ	v e r i g ə	v e r i g ə	a n i ʝ o -	a n i ʝ o
RING_(MAKE_SOUND)	t̪ ɾ u k a -	t̪ ɾ u k a	s ɔ - n - - e	s ɔ n e	s u o n a r e	s u o n a r e	t ɪ nː iː r ɛ	t ɪ nː iː r ɛ	t - u k a r	t u k a r	s u - n - - a	s u n a	t o k a ɾ + e l + t i m b ɾ e	t o k a ɾ + e l + t i m b ɾ e
RINSE	ə s β ə n ð i	ə s β ə n ð i	ʁ ɛ̃ s e	ʁ ɛ̃ s e	- ʃ a k k w a r e	ʃ a k k w a r e	p ɛ r lˠ ʊ ɛ r ɛ	p ɛ r lˠ ʊ ɛ r ɛ	ẽ ʃ ɐ - g w a r -	ẽ ʃ ɐ g w a r	k l ə tʲ	k l ə tʲ	e ɴ x w a ɣ a ɾ	e ɴ x w a ɣ a ɾ
RIPE	m ə ð u - - -	m ə ð u	m yː ʁ	m yː ʁ	m a t u r o -	m a t u r o	m aː t uː r ʊ s	m aː t uː r ʊ s	m ɐ ð u r u -	m ɐ ð u r u	k o p t	k o p t	m a ð u ɾ o -	m a ð u ɾ o
RIPEN	- m ə ð u ɾ a - - - - -	m ə ð u ɾ a	- m - - y ʁ iː - - - ʁ -	m y ʁ iː ʁ	- m a t u r a - - - r e	m a t u r a r e	- m aː t ʊ r eː s k ɛ r ɛ	m aː t ʊ r eː s k ɛ r ɛ	a m a ð u r e s - e r -	a m a ð u r e s e r	p ɨ r g u j	p ɨ r g u j	- m a ð u ɾ a - - - ɾ -	m a ð u ɾ a ɾ
RISE_(MOVE_UPWARDS)	s u ɾ t̪ - - i	s u ɾ t̪ i	s ə l ə v e	s ə l ə v e	s p u n t a r e	s p u n t a r e	ɔ r iː r iː	ɔ r iː r iː	n ɐ ʃ s e r	n ɐ ʃ s e r	r ə s ə rʲ	r ə s ə rʲ	s a l i ɾ -	s a l i ɾ
RIVER	r i w -	r i w	ʁ i v j ɛː ʁ	ʁ i v j ɛː ʁ	f i u m e	f i u m e	f lˠ uː m ɛ n	f lˠ uː m ɛ n	ʀ i w -	ʀ i w	f l u v i w	f l u v i w	ɾ i - o	ɾ i o
ROAD	k ə r ə t̪ ɛ ɾ ə	k ə r ə t̪ ɛ ɾ ə	ʁ u t	ʁ u t	- s t r a d a	s t r a d a	w ɪ a	w ɪ a	e s t r a d a	e s t r a d a	- s t r a d ə	s t r a d ə	k a r e t e ɾ a	k a r e t e ɾ a
ROAR_(OF_SEA)	r u ʒ i	r u ʒ i	m y ʒ iː ʁ	m y ʒ iː ʁ	r u m o r e d dʒ a r e	r u m o r e d dʒ a r e	s a ɛ w iː r ɛ	s a ɛ w iː r ɛ	b r a m a r	b r a m a r	v u j	v u j	θ u m b a ɾ -	θ u m b a ɾ
ROOF	t̪ ə w lˠ a ð ə	t̪ ə w lˠ a ð ə	t w a	t w a	t e - tː o	t e tː o	t eː k t ʊ̃	t eː k t ʊ̃	t ə - ʎ a ð u	t ə ʎ a ð u	a k o p e r i ʃ	a k o p e r i ʃ	t e - x a ð o	t e x a ð o
ROOSTER	g a ʎ - - -	g a ʎ	k ɔ k	k ɔ k	g a lː - - o	g a lː o	g a lː ʊ s -	g a lː ʊ s	g a l - - u	g a l u	k o k o ʃ	k o k o ʃ	g a - - ʝ o	g a ʝ o
ROOT	ə r ɛ lˠ	ə r ɛ lˠ	ʁ a s i n	ʁ a s i n	r a d i tʃ e	r a d i tʃ e	r aː d iː k s	r aː d iː k s	ʀ ɐ i ʃ	ʀ ɐ i ʃ	r ə d ə tʃ i n ə	r ə d ə tʃ i n ə	ɾ a i θ	ɾ a i θ
ROT	p u ð ɾ i ɾ z ə	p u ð ɾ i ɾ z ə	p u - ʁ iː ʁ - -	p u ʁ iː ʁ	i m p u t r i d i r e	i m p u t r i d i r e	p uː t eː s k ɛ r ɛ	p uː t eː s k ɛ r ɛ	a p o ð r e s e r	a p o ð r e s e r	p u t r e zʲ	p u t r e zʲ	p u ð ɾ i ɾ s e	p u ð ɾ i ɾ s e
ROUND	r u ð o	r u ð o	ʁ ɔ̃	ʁ ɔ̃	r o t o n d o -	r o t o n d o	r ɔ t ʊ n d ʊ s	r ɔ t ʊ n d ʊ s	ʀ ə ð õ - d u -	ʀ ə ð õ d u	tʃ i r k u l a r	tʃ i r k u l a r	ɾ e ð o n d o -	ɾ e ð o n d o
ROW	r ə m - - - - a	r ə m a	ʁ a m - - - - e	ʁ a m e	r e m - - a r e	r e m a r e	r eː m ɪ g aː r ɛ	r eː m ɪ g aː r ɛ	r e m - - a r -	r e m a r	l o p ə t a	l o p ə t a	ɾ e m - - a ɾ -	ɾ e m a ɾ
RUB	- - f ɾ ə ɣ a - -	f ɾ ə ɣ a	f ʁ ɔ t e -	f ʁ ɔ t e	- - f r e g a r e	f r e g a r e	t ɛ r ɛ r ɛ	t ɛ r ɛ r ɛ	i ʃ f r e ɣ a r -	i ʃ f r e ɣ a r	f r i k ts j o n a	f r i k ts j o n a	f ɾ o t a ɾ	f ɾ o t a ɾ
RULE	d̪ u m i n - - a	d̪ u m i n a	m ɛ t ʁ i z e	m ɛ t ʁ i z e	d o m i n a r e	d o m i n a r e	ɪ m p ɛ r aː r ɛ	ɪ m p ɛ r aː r ɛ	ĩ - p e r a r -	ĩ p e r a r	s t ə p ɨ nʲ	s t ə p ɨ nʲ	d o m i n a ɾ -	d o m i n a ɾ
RUN	k o r ə - -	k o r ə	k u ʁ iː ʁ -	k u ʁ iː ʁ	k o rː e r e	k o rː e r e	k ʊ rː ɛ r ɛ	k ʊ rː ɛ r ɛ	k u ʀ e r -	k u ʀ e r	a l e r g a	a l e r g a	k o r e ɾ -	k o r e ɾ
RUSTLE_(OF_LEAVES)	m u ɾ m u ɾ a -	m u ɾ m u ɾ a	b ʁ y iː ʁ	b ʁ y iː ʁ	f r u ʃː a r e	f r u ʃː a r e	k r ɛ p aː r ɛ	k r ɛ p aː r ɛ	r u m o r e ʒ a r	r u m o r e ʒ a r	v ɨ ʒ ɨ j	v ɨ ʒ ɨ j	m u ɾ m u ɾ a ɾ	m u ɾ m u ɾ a ɾ
SACK	s a k ə -	s a k ə	s a k - -	s a k	s a kː o -	s a kː o	s a kː ʊ s	s a kː ʊ s	ʃ a k a -	ʃ a k a	s a k - -	s a k	s a k o -	s a k o
SAD	t̪ ɾ i s - -	t̪ ɾ i s	t ʁ i s t -	t ʁ i s t	t r i s t e	t r i s t e	m a ɛ s t ʊ s	m a ɛ s t ʊ s	t r i ʃ t ə	t r i ʃ t ə	m ɨ h n i t	m ɨ h n i t	t ɾ i s t e	t ɾ i s t e
SALT	s a lˠ -	s a lˠ	s ɛ l -	s ɛ l	s a l e	s a l e	s aː lˠ -	s aː lˠ	s a lˠ -	s a lˠ	s a r e	s a r e	s a l -	s a l
SAND	ə ɾ ɛ n ə	ə ɾ ɛ n ə	s ɑː b l ə	s ɑː b l ə	s a bː i a	s a bː i a	a r eː n a	a r eː n a	ɐ r e j ɐ	ɐ r e j ɐ	n i s i p	n i s i p	a ɾ e n a	a ɾ e n a
SATURDAY	d̪ i s a p t̪ ə	d̪ i s a p t̪ ə	s a m d i	s a m d i	s a b a t o	s a b a t o	d ɪ eː s + s a t ʊ r n iː	d ɪ eː s + s a t ʊ r n iː	s a β ɐ ð u	s a β ɐ ð u	s ɨ m b ə t ə	s ɨ m b ə t ə	s a β a ð o	s a β a ð o
SAY	d̪ i - - - -	d̪ i	d iː - - ʁ -	d iː ʁ	d i - - r e	d i r e	d iː k ɛ r ɛ	d iː k ɛ r ɛ	d i z e r -	d i z e r	s p u n e	s p u n e	d e θ i ɾ -	d e θ i ɾ
SCRAPE	r ə s p a -	r ə s p a	e g ʁ a t - i ɲ e	e g ʁ a t i ɲ e	- g r a fː i a r e	g r a fː i a r e	- - r aː d - ɛ r ɛ	r aː d ɛ r ɛ	r a ʃ p a r	r a ʃ p a r	z g ɨ r j a	z g ɨ r j a	ɾ a s k a ɾ	ɾ a s k a ɾ
SEA	m a - -	m a	m ɛː ʁ -	m ɛː ʁ	m a r e	m a r e	m a r ɛ	m a r ɛ	m a r -	m a r	m a r e	m a r e	m a ɾ -	m a ɾ
SECOND	s ə ɣ ɔ - n - -	s ə ɣ ɔ n	d ø z j ɛ m	d ø z j ɛ m	s e k o n d o -	s e k o n d o	s ɛ k ʊ n d ʊ s	s ɛ k ʊ n d ʊ s	s ə ɣ ũ - d u -	s ə ɣ ũ d u	a l + d o j l e a	a l + d o j l e a	s e ɣ u n d o -	s e ɣ u n d o
SEE	β - ɛ w - ɾ ə	β ɛ w ɾ ə	v w aː - - ʁ -	v w aː ʁ	v - e d e r e	v e d e r e	w - ɪ d eː r ɛ	w ɪ d eː r ɛ	v - e - - r -	v e r	v - e d e - a	v e d e a	b - e - - ɾ -	b e ɾ
SEED	s - ɛ m β ɾ ə	s ɛ m β ɾ ə	s ə m ɑ̃ː s	s ə m ɑ̃ː s	s e m e n t e	s e m e n t e	s ɛ g ɛ s	s ɛ g ɛ s	ʃ e m ẽ t e j r a	ʃ e m ẽ t e j r a	s e m ə n ə t u r ə	s e m ə n ə t u r ə	s j e m b ɾ a	s j e m b ɾ a
SEEM	s ə m b lˠ - - a	s ə m b lˠ a	p a ʁ ɛː t - ʁ ə	p a ʁ ɛː t ʁ ə	s e m b r a r e	s e m b r a r e	w ɪ d eː r iː	w ɪ d eː r iː	p ɐ r ə s e r -	p ɐ r ə s e r	p ə r e - a - -	p ə r e a	p a ɾ e θ e ɾ -	p a ɾ e θ e ɾ
SEIZE	ə ɣ ə f a	ə ɣ ə f a	p ʁ ɑ̃ː d ʁ ə	p ʁ ɑ̃ː d ʁ ə	a fː e rː a r e	a fː e rː a r e	k a p ɛ sː ɛ r ɛ	k a p ɛ sː ɛ r ɛ	ɐ p ɐ ɲ a r	ɐ p ɐ ɲ a r	a p u k a	a p u k a	k o x e ɾ	k o x e ɾ
SELL	β ɛ n ð - ɾ ə	β ɛ n ð ɾ ə	v ɑ̃ː - d - ʁ ə	v ɑ̃ː d ʁ ə	v e n d e r e	v e n d e r e	w eː n d ɛ r ɛ	w eː n d ɛ r ɛ	v ẽ - d e r -	v ẽ d e r	v i n d - - e	v i n d e	b e n d e ɾ -	b e n d e ɾ
SEND	ə m β - i - - a	ə m β i a	ɑ̃ v w a j e	ɑ̃ v w a j e	i ɱ v - i a r e	i ɱ v i a r e	m ɪ tː ɛ r ɛ	m ɪ tː ɛ r ɛ	ẽ - v j a - r -	ẽ v j a r	t r i m i t e	t r i m i t e	e m b j a - ɾ -	e m b j a ɾ
SEPARATE	s ə p ə ɾ - a ɾ z ə	s ə p ə ɾ a ɾ z ə	s ə s e p a ʁ e	s ə s e p a ʁ e	s e p a r - a r z i	s e p a r a r z i	d ɪ s k eː d ɛ r ɛ	d ɪ s k eː d ɛ r ɛ	- a p a r t a r ʃ e	a p a r t a r ʃ e	s e + d e s p ə r tsʲ	s e + d e s p ə r tsʲ	s e p a ɾ - a ɾ s e	s e p a ɾ a ɾ s e
SEPTEMBER	s ə - t̪ - ɛ m β - ɾ - ə	s ə t̪ ɛ m β ɾ ə	s ɛ p t - ɑ̃ː - b - ʁ - ə	s ɛ p t ɑ̃ː b ʁ ə	s e - tː - e m b - r - e	s e tː e m b r e	s ɛ p t - ɛ m b ɛ r - -	s ɛ p t ɛ m b ɛ r	s ə - t - ẽ - b - r - u	s ə t ẽ b r u	s e p t - e m b - r j e	s e p t e m b r j e	s e β t j e m b - ɾ - e	s e β t j e m b ɾ e
SET_(HEAVENLY_BODIES)	p u z a ɾ z ə	p u z a ɾ z ə	s ə k u ʃ e	s ə k u ʃ e	t r a m o n t a r e	t r a m o n t a r e	ɔ kː ɪ d ɛ r ɛ	ɔ kː ɪ d ɛ r ɛ	p o - - r ʃ e	p o r ʃ e	a p u n e	a p u n e	d e s θ e n d e ɾ	d e s θ e n d e ɾ
SEVEN	s - ɛ - t̪ -	s ɛ t̪	s - ɛ - t -	s ɛ t	s - e - tː e	s e tː e	s - ɛ p t ɛ̃	s ɛ p t ɛ̃	s - ɛ - t ə	s ɛ t ə	ʃ - a p t e	ʃ a p t e	s j e - t e	s j e t e
SEVENTY	s ə - t̪ - - - a n̪ t̪ ə	s ə t̪ a n̪ t̪ ə	s w a s ɑ̃ t d i s	s w a s ɑ̃ t d i s	s e - tː - - - a n t a	s e tː a n t a	s ɛ p t ʊ aː g ɪ n t aː	s ɛ p t ʊ aː g ɪ n t aː	s ə - t - - - ẽ - t ɐ	s ə t ẽ t ɐ	ʃ a p t e z e tʃʲ	ʃ a p t e z e tʃʲ	s e - t - - - e n t a	s e t e n t a
SEVERE	g ɾ ɛ w -	g ɾ ɛ w	m o v ɛ	m o v ɛ	g r a v e	g r a v e	m a lˠ ʊ s	m a lˠ ʊ s	g r a v ə	g r a v ə	- r ə w -	r ə w	g ɾ a β e	g ɾ a β e
SEW	k u - - z i	k u z i	k uː d - ʁ ə	k uː d ʁ ə	k u tʃ i r e	k u tʃ i r e	s ʊ ɛ r ɛ	s ʊ ɛ r ɛ	k o ʃ t u r a r	k o ʃ t u r a r	k o - a s e	k o a s e	k o s e ɾ -	k o s e ɾ
SHADE	- ɔ m β ɾ ə	ɔ m β ɾ ə	- ɔ̃ː - b ʁ ə	ɔ̃ː b ʁ ə	- o m b r a	o m b r a	- ʊ m b r a	ʊ m b r a	s õ - b r ɐ	s õ b r ɐ	- u m b r ə	u m b r ə	s o m b ɾ a	s o m b ɾ a
SHAKE	s ə k s ə ʒ a	s ə k s ə ʒ a	s ə k w e	s ə k w e	s - k u ɔ t e r e	s k u ɔ t e r e	- kʷ a t ɛ r ɛ	kʷ a t ɛ r ɛ	s ɐ k u - ð i r -	s ɐ k u ð i r	s - k u - t u r a	s k u t u r a	s a k u - ð i ɾ -	s a k u ð i ɾ
SHARP	ə ɣ u t̪ -	ə ɣ u t̪	t ʁ ɑ̃ ʃ ɑ̃	t ʁ ɑ̃ ʃ ɑ̃	t a ʎː i e n t e	t a ʎː i e n t e	aː k ɛ r	aː k ɛ r	a f - j a ð u	a f j a ð u	a s k u ts i t	a s k u ts i t	a f i l a ð o	a f i l a ð o
SHARPEN_(SOMETHING)	ə z m u lˠ a	ə z m u lˠ a	e g ɥ i z e	e g ɥ i z e	a rː o t a r e	a rː o t a r e	a k ʊ ɛ r ɛ	a k ʊ ɛ r ɛ	a f j a r - -	a f j a r	a s k u tsʲ	a s k u tsʲ	a f - i l a ɾ	a f i l a ɾ
SHEEP	u β ɛ ʎ ə	u β ɛ ʎ ə	m u t ɔ̃	m u t ɔ̃	p ɛ k o r a	p ɛ k o r a	ɔ w ɪ s	ɔ w ɪ s	o v e ʎ ɐ	o v e ʎ ɐ	o a j e	o a j e	o β e x a	o β e x a
SHELF	p ɾ ə s t ə - dʒ ə ɾ i ə	p ɾ ə s t ə dʒ ə ɾ i ə	e t a ʒ ɛː ʁ	e t a ʒ ɛː ʁ	s k a fː a l e	s k a fː a l e	f ɔ r ʊ l iː	f ɔ r ʊ l iː	p r a t e l e j r a	p r a t e l e j r a	r a f t u rʲ	r a f t u rʲ	- - e s t a n t e ɾ i a	e s t a n t e ɾ i a
SHINE	b ɾ i ʎ a -	b ɾ i ʎ a	b ʁ i j e -	b ʁ i j e	- - s p l ɛ n d - - e r e	s p l ɛ n d e r e	lˠ uː k eː r ɛ	lˠ uː k eː r ɛ	b r i ʎ a r	b r i ʎ a r	s t r ə l u tʃʲ	s t r ə l u tʃʲ	b ɾ i ʝ a ɾ	b ɾ i ʝ a ɾ
SHIRT	k ə m i z ə	k ə m i z ə	ʃ m iː z	ʃ m iː z	k a m i tʃ a	k a m i tʃ a	t ʊ n ɪ k a	t ʊ n ɪ k a	k ɐ m i z ɐ	k ɐ m i z ɐ	k ə m a ʃ ə	k ə m a ʃ ə	k a m i s a	k a m i s a
SHIVER	t̪ ɾ ə m - - u lˠ a	t̪ ɾ ə m u lˠ a	t ʁ ɑ̃ b - - - l e	t ʁ ɑ̃ b l e	t r e m - - a r e	t r e m a r e	t r ɛ p ɪ d aː r ɛ	t r ɛ p ɪ d aː r ɛ	t r ə m - - e r -	t r ə m e r	t r e m - - u r a	t r e m u r a	t e m b l a ɾ	t e m b l a ɾ
SHOE	s ə β a t̪ ə	s ə β a t̪ ə	ʃ o s yː ʁ	ʃ o s yː ʁ	s k a r p a	s k a r p a	k a lˠ k ɛ ʊ s	k a lˠ k ɛ ʊ s	s ɐ p a t u	s ɐ p a t u	g e a t ə	g e a t ə	θ a p a t o	θ a p a t o
SHOOT	d̪ i s p ə ɾ a - -	d̪ i s p ə ɾ a	t - - - i ʁ e - -	t i ʁ e	s - - p a r a r e	s p a r a r e	ɪ a k ʊ lˠ aː r iː	ɪ a k ʊ lˠ aː r iː	d i ʃ p a r a r -	d i ʃ p a r a r	t r a dʒ e	t r a dʒ e	d i s p a ɾ a ɾ -	d i s p a ɾ a ɾ
SHOP	b u t̪ i ɣ ə	b u t̪ i ɣ ə	b u t i k -	b u t i k	n e g o ts i o	n e g o ts i o	t a b ɛ r n a	t a b ɛ r n a	l ɔ ʒ ɐ	l ɔ ʒ ɐ	p r ə v ə l j e	p r ə v ə l j e	t j e n d a	t j e n d a
SHORE_OF_LAKE	r i β ə -	r i β ə	ʁ i v aː ʒ	ʁ i v aː ʒ	r i v a -	r i v a	r iː p a -	r iː p a	b e j r a	b e j r a	ts ə r m	ts ə r m	o ɾ i ʝ a	o ɾ i ʝ a
SHORT	k u ɾ - -	k u ɾ	k uː ʁ - -	k uː ʁ	k o r t o	k o r t o	b r ɛ w ɪ s	b r ɛ w ɪ s	k u r t u	k u r t u	s k u r t	s k u r t	k o ɾ t o	k o ɾ t o
SHOULDER	ə s p a ʎː ə	ə s p a ʎː ə	e p oː l	e p oː l	- s p a lː a	s p a lː a	ʊ m ɛ r ʊ s	ʊ m ɛ r ʊ s	õ - b r u	õ b r u	s p a t e	s p a t e	o m b ɾ o	o m b ɾ o
SHOUT	k ɾ i ð a - -	k ɾ i ð a	k ʁ i - e - -	k ʁ i e	g r i d a r e	g r i d a r e	k lˠ aː m aː r ɛ	k lˠ aː m aː r ɛ	g r i t a r -	g r i t a r	ts i p a	ts i p a	g ɾ i t a ɾ -	g ɾ i t a ɾ
SHOVEL	p a lˠ - - ə	p a lˠ ə	p ɛ l - - -	p ɛ l	p a l - - a	p a l a	p aː lˠ - - a	p aː lˠ a	p a	p a	l o p a t ə	l o p a t ə	p a l e t a	p a l e t a
SHOW	ə n z ə ɲ a	ə n z ə ɲ a	f ɛː ʁ + v w aː ʁ	f ɛː ʁ + v w aː ʁ	i n d i k a r e	i n d i k a r e	m õː s t r aː r ɛ	m õː s t r aː r ɛ	m u ʃ t r a r -	m u ʃ t r a r	a r ə t a	a r ə t a	m o s t ɾ a ɾ -	m o s t ɾ a ɾ
SHUT	t̪ ə ŋ k a	t̪ ə ŋ k a	f ɛ ʁ m e	f ɛ ʁ m e	k j u - d e r e	k j u d e r e	k lˠ a ʊ d ɛ r ɛ	k lˠ a ʊ d ɛ r ɛ	f ə ʃ a r	f ə ʃ a r	ɨ n k i d e	ɨ n k i d e	θ e r a ɾ	θ e r a ɾ
SICK	m ə lˠ a lˠ -	m ə lˠ a lˠ	m a l a d -	m a l a d	i ɱ f e r m o	i ɱ f e r m o	a ɛ g ɛ r	a ɛ g ɛ r	ẽ - f e r m u	ẽ f e r m u	b o l n a v	b o l n a v	e ɱ f e ɾ m o	e ɱ f e ɾ m o
SIDE	k u s t a t̪ -	k u s t a t̪	k o - t e - -	k o t e	p a r t e	p a r t e	lˠ a t ʊ s	lˠ a t ʊ s	l a ð u -	l a ð u	l a t u r ə	l a t u r ə	k o s t a ð o	k o s t a ð o
SIGN	s ə - ɲ a lˠ -	s ə ɲ a lˠ	s i - ɲ -	s i ɲ	s e - ɲː a l e	s e ɲː a l e	s iː ŋ n ʊ̃	s iː ŋ n ʊ̃	m a r k a	m a r k a	s e m n a l -	s e m n a l	s e - ɲ a l -	s e ɲ a l
SILENCE	s i lˠ ɛ n s - i	s i lˠ ɛ n s i	t ʁ ɑ̃ - k - i l i t e	t ʁ ɑ̃ k i l i t e	t r a n k w i lː i t a	t r a n k w i lː i t a	kʷ ɪ eː s	kʷ ɪ eː s	s i l ẽ - s j u	s i l ẽ s j u	l i n i ʃ t e	l i n i ʃ t e	s i l e n θ j o	s i l e n θ j o
SILVER	p lˠ a t̪ ə	p lˠ a t̪ ə	a ʁ ʒ ɑ̃	a ʁ ʒ ɑ̃	a r dʒ e n t o	a r dʒ e n t o	a r g ɛ n t ʊ̃	a r g ɛ n t ʊ̃	p r a t ɐ	p r a t ɐ	a r dʒ i n t -	a r dʒ i n t	p l a t a	p l a t a
SIN	p ə k a t̪ -	p ə k a t̪	p e ʃ e	p e ʃ e	p e kː a t o	p e kː a t o	p ɛ kː aː t ʊ̃	p ɛ kː aː t ʊ̃	p ə k a ð u	p ə k a ð u	p ə k a t -	p ə k a t	p e k a ð o	p e k a ð o
SING	k ə n̪ t̪ - - a	k ə n̪ t̪ a	ʃ ɑ̃ t e	ʃ ɑ̃ t e	k a n t a r e	k a n t a r e	k a n t aː r ɛ	k a n t aː r ɛ	k ɐ̃ - t a r -	k ɐ̃ t a r	k ɨ n t - - a	k ɨ n t a	k a n t a ɾ -	k a n t a ɾ
